{
  "review_id": "RV-20260528-001",
  "run_id": "RUN-20260528-001",
  "work_package_id": "WP-2026W22-002",
  "reviewer_agent": "qa",
  "review_type": "qa",
  "started_at": "2026-05-28T07:45:54+09:00",
  "ended_at": "2026-05-28T07:45:54+09:00",
  "checks": [
    {
      "name": "Godot CLI is available",
      "status": "pass",
      "evidence": [
        "godot --version -> 4.6.3.stable.official.7d41c59c4"
      ],
      "notes": "The previous environment blocker is resolved."
    },
    {
      "name": "Smoke test passes",
      "status": "pass",
      "evidence": [
        "scripts/smoke_test.sh exit code 0"
      ],
      "notes": "The tiny Godot project loads successfully in headless mode."
    },
    {
      "name": "No implementation files changed during recheck",
      "status": "pass",
      "evidence": [
        "RUN-20260528-001 scope_report touched_paths=[runs/RUN-20260528-001.json]"
      ],
      "notes": "The recheck only added evidence; it did not modify the Godot project or scripts."
    },
    {
      "name": "Desktop runnable gate is unblocked",
      "status": "pass",
      "evidence": [
        "RUN-20260527-002 status=blocked",
        "RV-20260527-002 decision=blocked",
        "RUN-20260528-001 status=completed"
      ],
      "notes": "The Phase 1 tiny desktop smoke-test gate can now proceed to learning capture review."
    }
  ],
  "scope_findings": {
    "target_violations": [],
    "forbidden_change_violations": []
  },
  "issues": [],
  "decision": "pass",
  "human_decision_required": false,
  "notes": "QA passes the recheck. The prior blocker was local Godot CLI availability, not implementation scope or artifact absence."
}
