{
  "review_id": "RV-20260711-003",
  "run_id": "RUN-20260711-005",
  "work_package_id": "WP-2026W28-045",
  "reviewer_agent": "qa",
  "review_type": "qa",
  "started_at": "2026-07-11T08:07:00+09:00",
  "ended_at": "2026-07-11T08:11:07+09:00",
  "checks": [
    {
      "name": "Review-driven implementation and audit evidence validate",
      "status": "pass",
      "evidence": [
        "WP-044 and RUN-20260711-005 validate against their schemas.",
        "The frozen review-rework commits 10dc411 and f72a442 include the scene hierarchy adjustment, durable traversal test plus UID, audit correction, and their Work Package/Run evidence.",
        "WP-040 documents the post-owner-approval implementation authority for the approved art baseline commit.",
        "RUN-20260710-001 now includes WP-039 in touched_paths."
      ],
      "notes": "The prior Standards review findings are addressed without rewriting history or weakening the WP-039 pre-approval boundary."
    },
    {
      "name": "Input-driven multi-section traversal is playable and winnable",
      "status": "pass",
      "evidence": [
        "game/tests/qa_phase4b_traversal.gd drives only ui_right and ui_accept against the instantiated production scene and never assigns the player transform.",
        "The player reaches the warmup step at x=244.36/y=291.00 and the elevated platform at x=466.55/y=245.93 through real collision and jump physics.",
        "The player then jumps the hazard, collects the item, and reaches the goal at x=1030.22 with approximately 17.9 seconds remaining.",
        "The test ends with result=SUCCESS and item=true."
      ],
      "notes": "This directly proves the Phase 4B multi-section flow is reachable and the hazard is not unintentionally unwinnable."
    },
    {
      "name": "Complete state-transition regression remains green",
      "status": "pass",
      "evidence": [
        "Goal-before-item gating, item collection, success, success reset, hazard failure, hazard retry stability, and timer failure pass in one live-scene run.",
        "The prior hazard-retry stale-overlap defect remains fixed under the same regression that found it."
      ],
      "notes": "Traversal coverage and state-transition coverage are complementary and both pass."
    },
    {
      "name": "Configured visual hierarchy matches the approved contract",
      "status": "pass",
      "evidence": [
        "Configured dimensions are player 51.24x79.49, goal 38.16x76.79, hazard 48.04x50.57, and item 32.50x50.57.",
        "Rendered area satisfies Player > Goal > Hazard > Item, while hazard and item share an equal 50.57px height for their equal tier.",
        "/private/tmp/halucy_wp044_preview00000001.png shows the enlarged teal player as the strongest start-view foreground read.",
        "/private/tmp/halucy_wp040_right_view.png shows the player strongest, the tall goal second, hazard/item as a smaller matched tier, and the background lowest."
      ],
      "notes": "The hazard backing wash was reduced so it supports danger recognition without overpowering the goal. Labels remain secondary aids."
    },
    {
      "name": "Approved v2 art, single background, and production boundary remain intact",
      "status": "pass",
      "evidence": [
        "All seven v2 PNG assets remain present, imported, and referenced by the scene.",
        "The scene contains one BackgroundWorldLayer and no v1 or split-backdrop reference.",
        "The manifest still records owner approval only for prototype integration planning and production_approved=false for every asset.",
        "No image, collision, gameplay layout, or project-setting file changed during review remediation."
      ],
      "notes": "The task remains prototype implementation/QA, not final or production art approval."
    },
    {
      "name": "Import, smoke, runtime, and QA scope are clean",
      "status": "pass",
      "evidence": [
        "Godot 4.6.3 import exited 0.",
        "Smoke clean-output guard exited 0.",
        "Headless main-scene runtime clean-output guard exited 0.",
        "Final post-review QA started from a frozen implementation and modified only WP-045, RV-20260711-003, and RUN-20260711-006."
      ],
      "notes": "No implementation file was changed during this QA pass."
    }
  ],
  "scope_findings": {
    "target_violations": [],
    "forbidden_change_violations": []
  },
  "issues": [],
  "decision": "pass",
  "human_decision_required": true,
  "human_decision_reason": "Automated traversal, state-transition, render, import, and runtime QA prove the build is playable-review ready, but BK/Human Creative Owner retains final subjective in-motion play/feel and any production-art authority.",
  "notes": "Post-review final QA passes with no open technical or scope issue. The approved v2 art set is integrated, actual input proves the full route can be completed, gameplay regressions are green, the visual hierarchy matches its configured contract, and audit metadata is consistent. No production, push, merge, deployment, or Phase 4B closeout approval is implied."
}
