{
  "review_id": "RV-20260531-003",
  "run_id": "RUN-20260531-011",
  "work_package_id": "WP-2026W22-028",
  "reviewer_agent": "qa",
  "review_type": "scope",
  "started_at": "2026-05-31T16:53:02+09:00",
  "ended_at": "2026-05-31T16:53:02+09:00",
  "checks": [
    {
      "name": "Phase 3 owner decision is recorded",
      "status": "pass",
      "evidence": [
        "owner_reviews/OR-2026W22-004-phase3-godot-import-KR.md records Decision: approve implemented result for Phase 3 Art Production Capability Validation gate",
        "The owner decision records BK direct test summary: 직접 테스트했고 합격",
        "The owner decision excludes final art, production asset approval, gameplay expansion, platform launch feedback, and external tester workflow"
      ],
      "notes": "The final human decision is durable and scoped."
    },
    {
      "name": "Smoke-test output is clean",
      "status": "pass",
      "evidence": [
        "bash -lc 'out=$(scripts/smoke_test.sh 2>&1); printf \"%s\\n\" \"$out\"; ! grep -E \"SCRIPT ERROR|ERROR:\" <<< \"$out\"' exit code 0"
      ],
      "notes": "Final closeout smoke check was clean."
    },
    {
      "name": "Main scene runs headlessly",
      "status": "pass",
      "evidence": [
        "godot --headless --path game --scene res://scenes/main.tscn --quit-after 3 exit code 0"
      ],
      "notes": "The imported asset scene still loads and runs after closeout artifacts."
    },
    {
      "name": "Phase 3 Work Package schemas validate",
      "status": "pass",
      "evidence": [
        "WP-2026W22-018 through WP-2026W22-028 validate against schemas/work_package.schema.json"
      ],
      "notes": "AJV format warnings are expected in this repo because the format plugin is not bundled."
    },
    {
      "name": "Phase 3 Run schemas validate",
      "status": "pass",
      "evidence": [
        "RUN-20260531-001 through RUN-20260531-011 validate against schemas/run.schema.json"
      ],
      "notes": "Run records cover Phase 3A through closeout."
    },
    {
      "name": "Phase 3 Review and Learning schemas validate",
      "status": "pass",
      "evidence": [
        "reviews/RV-20260531-001.json through reviews/RV-20260531-003.json validate against schemas/review.schema.json",
        "learning_cards/candidate/LC-20260531-001.json and LC-20260531-002.json validate against schemas/learning_card.schema.json"
      ],
      "notes": "Learning capture remains Candidate only."
    },
    {
      "name": "Imported asset package remains present",
      "status": "pass",
      "evidence": [
        "Final closeout check confirmed all four game/assets/phase3e/*.png files exist",
        "Final closeout check confirmed all four game/assets/phase3e/*.png.import files exist"
      ],
      "notes": "The technical import package is still present for BK/manual follow-up."
    },
    {
      "name": "Final dirty scope is expected",
      "status": "pass",
      "evidence": [
        "Final git status shows expected Phase 3 artifacts, game/scenes/main.tscn, game/assets/phase3e/**, and game/scripts/player.gd.uid",
        "No unrelated tracked file edits were introduced by closeout beyond closeout artifacts"
      ],
      "notes": "Phase 3 remains uncommitted; commit/staging boundary is deferred."
    }
  ],
  "scope_findings": {
    "target_violations": [],
    "forbidden_change_violations": []
  },
  "issues": [],
  "decision": "pass",
  "human_decision_required": false,
  "notes": "Final Phase 3 closeout verification passed. Phase 3 is ready to close with PHASE3_CLOSEOUT.md and hand off to Phase 4 Production System Retrospective planning."
}
