{
  "review_id": "RV-20260531-001",
  "run_id": "RUN-20260531-004",
  "work_package_id": "WP-2026W22-021",
  "reviewer_agent": "qa",
  "review_type": "qa",
  "started_at": "2026-05-31T15:34:18+09:00",
  "ended_at": "2026-05-31T15:34:18+09:00",
  "checks": [
    {
      "name": "CSV review surfaces are present and parseable",
      "status": "pass",
      "evidence": [
        "art_candidates/phase3b/asset_requirements.csv parsed with 5 rows",
        "art_candidates/phase3b/asset_manifest.csv parsed with 5 rows",
        "Both CSV files include required_asset_id"
      ],
      "notes": "The package now has human-readable and human-editable review surfaces for the prototype asset list and candidate mapping."
    },
    {
      "name": "JSON structured records parse and align with CSV purpose",
      "status": "pass",
      "evidence": [
        "art_candidates/phase3b/asset_requirements.json parsed",
        "art_candidates/phase3b/asset_manifest.json parsed",
        "asset_requirements.json references human_editable_csv",
        "asset_manifest.json references asset_requirements_csv and manifest_csv"
      ],
      "notes": "JSON remains suitable as an agent-readable structured record while CSV is used as the human review/edit surface."
    },
    {
      "name": "Required asset inventory is explicit",
      "status": "pass",
      "evidence": [
        "asset_requirements.json lists REQ-P3B-001 through REQ-P3B-005",
        "count_rationale states that five assets cover the Phase 2 review-relevant visual roles for this capability slice",
        "explicitly_not_required_for_phase3b excludes background art, enemy art, item art, VFX, animation sheets, full tileset, menus, buttons, score UI, camera or transition art, and marketing art"
      ],
      "notes": "The package now explains why five assets are sufficient for Phase 3B while avoiding a false claim that this is a full game inventory."
    },
    {
      "name": "Each required asset maps to a candidate and individual file",
      "status": "pass",
      "evidence": [
        "REQ-P3B-001 maps to P3B-player-v1 and art_candidates/phase3b/individual/P3B-player-v1.png",
        "REQ-P3B-002 maps to P3B-floor-platform-v1 and art_candidates/phase3b/individual/P3B-floor-platform-v1.png",
        "REQ-P3B-003 maps to P3B-obstacle-v1 and art_candidates/phase3b/individual/P3B-obstacle-v1.png",
        "REQ-P3B-004 maps to P3B-goal-marker-v1 and art_candidates/phase3b/individual/P3B-goal-marker-v1.png",
        "REQ-P3B-005 maps to P3B-timer-hud-v1 and art_candidates/phase3b/individual/P3B-timer-hud-v1.png"
      ],
      "notes": "The prior contact-sheet-only reviewability defect is addressed for this prototype scale."
    },
    {
      "name": "Individual candidate files exist",
      "status": "pass",
      "evidence": [
        "test command confirmed all five individual PNG paths exist",
        "RUN-20260531-003 records dimensions and hashes for the five individual candidate files"
      ],
      "notes": "QA did not assess art taste, only package traceability and file availability."
    },
    {
      "name": "Owner redirect and rework boundary are recorded",
      "status": "pass",
      "evidence": [
        "owner_reviews/OR-2026W22-003-phase3b-art-candidates-KR.md records Decision: redirect",
        "The redirect reason says the original package did not report which art assets were needed and used one PNG without durable mapping",
        "The rework record adds asset_requirements.json, CSV review surfaces, individual candidate files, and manifest mapping"
      ],
      "notes": "The package does not pretend the original Phase 3B output was owner-approved."
    },
    {
      "name": "Implementation assessment covers target mapping and risks",
      "status": "pass",
      "evidence": [
        "implementation_notes/IN-2026W22-001-phase3c-asset-integration-assessment.md contains Godot Target Mapping",
        "The note contains Asset-by-Asset Assessment, Import Prep Needs, Visual Collision Alignment Risk, Gameplay Scope Risk, Excluded Implementation, and Next Work Package Options",
        "The note maps timer_hud to visual reference only and defer implementation"
      ],
      "notes": "The implementation handoff is assessment-only and does not authorize mutation."
    },
    {
      "name": "Implementation readiness limits are explicit",
      "status": "pass",
      "evidence": [
        "Implementation assessment says candidates are reviewable candidates, not implementation-ready sprites",
        "Manifest records transparency as none and import risks for all candidates",
        "Assessment says not to jump directly to Godot import"
      ],
      "notes": "The next implementation step is not Godot import; asset prep or further planning must come first."
    },
    {
      "name": "Forbidden scope is preserved",
      "status": "pass",
      "evidence": [
        "No Godot file changes are part of this QA run",
        "Phase 3C assessment excludes editing game/scenes/main.tscn, game/scripts/player.gd, game/project.godot, adding assets under game/**, creating Godot .import files, changing collision shapes, changing movement or HUD behavior, approving final art direction, or production use",
        "Owner review states implementation authorization is not authorized"
      ],
      "notes": "The package preserves the boundary between art candidate review, implementation assessment, asset prep, and Godot import."
    },
    {
      "name": "Phase 3D QA artifacts validate",
      "status": "pass",
      "evidence": [
        "WP-2026W22-022 validates against schemas/work_package.schema.json",
        "RV-20260531-001 validates against schemas/review.schema.json",
        "RUN-20260531-005 validates against schemas/run.schema.json"
      ],
      "notes": "Validation was run after artifact creation and recorded in RUN-20260531-005."
    }
  ],
  "scope_findings": {
    "target_violations": [],
    "forbidden_change_violations": []
  },
  "issues": [],
  "decision": "pass",
  "human_decision_required": true,
  "human_decision_reason": "QA can pass package traceability and scope review, but BK/Human Creative Owner still needs to decide the next authorized path: QA-to-learning capture, transparent asset prep, implementation planning, or stopping Phase 3.",
  "notes": "QA passes the Phase 3B/3C handoff package for prototype-scale traceability, CSV reviewability, candidate-file mapping, implementation assessment coverage, and forbidden-scope preservation. This pass does not approve final art, production use, transparent sprite generation, Godot import, or gameplay expansion."
}
