{
  "review_id": "RV-20260527-002",
  "run_id": "RUN-20260527-002",
  "work_package_id": "WP-2026W22-002",
  "reviewer_agent": "qa",
  "review_type": "qa",
  "started_at": "2026-05-27T00:00:00+09:00",
  "ended_at": "2026-05-27T00:00:00+09:00",
  "checks": [
    {
      "name": "Authorized artifacts are present",
      "status": "pass",
      "evidence": [
        "game/project.godot",
        "game/scenes/main.tscn",
        "game/scripts/player.gd",
        "scripts/build_game.sh",
        "scripts/smoke_test.sh",
        "runs/RUN-20260527-002.json"
      ],
      "notes": "The Implementation Run produced the artifacts authorized by WP-2026W22-002."
    },
    {
      "name": "Scope matches Work Package targets",
      "status": "pass",
      "evidence": [
        "RUN-20260527-002 scope_report target_violations=[]",
        "RUN-20260527-002 scope_report forbidden_change_violations=[]"
      ],
      "notes": "The Run reports no target or forbidden-change violations."
    },
    {
      "name": "Blocked smoke-test evidence is explicit",
      "status": "pass",
      "evidence": [
        "scripts/smoke_test.sh exit code 2",
        "Godot CLI was not found on PATH or at /Applications/Godot.app/Contents/MacOS/Godot"
      ],
      "notes": "The Run did not claim a runnable desktop slice after the local Godot CLI check failed."
    },
    {
      "name": "Desktop runnable behavior is verified",
      "status": "fail",
      "evidence": [
        "RUN-20260527-002 status=blocked",
        "scripts/smoke_test.sh exit code 2"
      ],
      "notes": "QA cannot verify desktop runnable behavior until Godot 4.x CLI is available locally."
    }
  ],
  "scope_findings": {
    "target_violations": [],
    "forbidden_change_violations": []
  },
  "issues": [
    {
      "severity": "blocker",
      "description": "Desktop runnable behavior cannot be verified because Godot 4.x CLI is unavailable in the local environment.",
      "suggested_owner": "implementation"
    }
  ],
  "decision": "blocked",
  "human_decision_required": false,
  "notes": "QA accepts the scope discipline and blocked evidence. Phase 1 cannot claim the tiny desktop runnable pass until the Godot CLI dependency is resolved and smoke_test.sh exits successfully."
}
